{
  "id": "urban",
  "name": "都市",
  "language": "zh",
  "chapter_types": [
    "opening",
    "daily",
    "conflict",
    "career",
    "relationship",
    "transition"
  ],
  "fatigue_words": [
    "嘴角微微上扬",
    "眼中闪过一丝玩味",
    "淡淡的",
    "冷笑",
    "蝼蚁",
    "不知天高地厚",
    "你也配",
    "给我等着",
    "恐怖如斯",
    "此子不可留",
    "盯着看",
    "低声说",
    "僵住了",
    "呼吸停滞",
    "呼吸一停",
    "自言自语",
    "喃喃自语",
    "死死盯着",
    "目不转睛地看着",
    "呼吸一滞",
    "低声说道",
    "停住了"
  ],
  "satisfaction_types": [
    "逆袭",
    "打脸",
    "职场晋升",
    "情感突破",
    "身份揭露",
    "危机化解"
  ],
  "has_numerical_system": false,
  "has_power_scaling": false,
  "pacing_rule": "日常章与冲突章交替推进，单章内必须包含至少一个情绪转折点。",
  "writer_rules": [
    "现代都市背景必须符合现实逻辑，避免出现无法自圆其说的超自然设定",
    "职场描写需符合行业常识，禁止明显违背现实的商业操作",
    "人际关系发展需有合理铺垫，禁止突兀的情感转变",
    "主角的金手指或系统能力必须有明确限制，禁止无限制滥用",
    "电子设备或系统消息须用引号或【】呈现，禁止使用 // 等代码注释符号拼接正文"
  ],
  "reviewer_focus": [
    "都市背景设定是否与现实逻辑冲突",
    "人际关系发展是否突兀",
    "职场/商业情节是否符合常识",
    "金手指使用是否过度且无代价"
  ],
  "active_audit_dimensions": [
    "world_consistency",
    "character_behavior",
    "timeline",
    "narrative_pacing",
    "narrative_hook",
    "info_dump",
    "dialogue_distinctness",
    "dialogue_subtext",
    "description_sensory",
    "show_dont_tell"
  ],
  "taboos": [
    "主角通过毫无代价的方式获得巨额财富或权力",
    "同一打脸套路反复使用",
    "配角完全工具化",
    "感情线突兀插入且无铺垫"
  ],
  "pacing_templates": [
    {
      "chapter_types": [
        "opening",
        "daily",
        "conflict",
        "career",
        "relationship",
        "transition"
      ],
      "emotion_arc": "职场逆袭",
      "punch_density": 1.5,
      "info_release_strategy": "日常章与冲突章交替推进，单章内必须包含至少一个情绪转折点。"
    }
  ],
  "style_baseline": {
    "sentence_rhythm": "短促有力",
    "description_density": 0.25,
    "dialogue_ratio": 0.4,
    "inner_monologue": "丰富",
    "pov_depth": "深"
  },
  "sensory_templates": [
    {
      "sense": "visual",
      "intensity_target": 0.6,
      "description_density": 100.0,
      "example_phrases": [
        "写字楼的玻璃幕墙映着晚霞，像一面巨大的调色板",
        "会议室的投影仪在墙上打出冷白的光斑"
      ]
    },
    {
      "sense": "auditory",
      "intensity_target": 0.5,
      "description_density": 50.0,
      "example_phrases": [
        "地铁进站的轰鸣声震得耳膜发胀",
        "键盘敲击声在深夜的办公室里格外清脆"
      ]
    },
    {
      "sense": "olfactory",
      "intensity_target": 0.3,
      "description_density": 30.0,
      "example_phrases": [
        "雨后街道上的泥土和汽油混合的气味",
        "咖啡馆里烘焙豆子的焦香"
      ]
    }
  ],
  "emotion_arc_library": [
    {
      "arc_name": "职场逆袭",
      "phases": [
        {
          "from": "压抑",
          "to": "机遇"
        },
        {
          "from": "机遇",
          "to": "振奋"
        }
      ],
      "typical_length_words": 3000,
      "suitable_chapter_types": [
        "career",
        "conflict"
      ]
    },
    {
      "arc_name": "情感升温",
      "phases": [
        {
          "from": "陌生",
          "to": "试探"
        },
        {
          "from": "试探",
          "to": "亲密"
        }
      ],
      "typical_length_words": 2800,
      "suitable_chapter_types": [
        "relationship",
        "daily"
      ]
    },
    {
      "arc_name": "冲突爆发",
      "phases": [
        {
          "from": "平静",
          "to": "摩擦"
        },
        {
          "from": "摩擦",
          "to": "对抗"
        }
      ],
      "typical_length_words": 2500,
      "suitable_chapter_types": [
        "conflict",
        "transition"
      ]
    }
  ],
  "reference_works": [
    "全职高手",
    "大医凌然",
    "亏成首富从游戏开始"
  ],
  "active_verbs": [
    "主动",
    "选择",
    "决定",
    "拒绝",
    "辞职",
    "摊牌",
    "举报",
    "签约",
    "断绝",
    "揭穿",
    "起诉",
    "反击",
    "放弃",
    "争取"
  ],
  "passive_only_patterns": [
    "继续等待",
    "继续隐忍",
    "继续承受",
    "维持现状"
  ],
  "cost_keywords": [
    "代价",
    "失业",
    "名誉",
    "亏损",
    "决裂",
    "风险",
    "损失",
    "受伤",
    "不可逆",
    "把柄"
  ],
  "supporting_action_keywords": [
    "拒绝",
    "坚持",
    "隐瞒",
    "阻止",
    "拦",
    "背叛",
    "举报",
    "抢",
    "签",
    "揭穿",
    "要挟",
    "迫使",
    "带",
    "施压"
  ],
  "consequence_keywords": [
    "延迟",
    "改变计划",
    "决裂",
    "代价",
    "误判",
    "压力",
    "暴露",
    "失去",
    "迫使",
    "波及"
  ]
}
